{
  "$schema": "https://rmside.invalid/schemas/message-catalog/v1",
  "schemaVersion": "1.1.0",
  "compatibility": {
    "minimumMajor": 1,
    "maximumMajor": 1
  },
  "locale": "zh-Hant",
  "name": "繁體中文",
  "direction": "ltr",
  "listPatterns": {
    "unit": {
      "two": "{0}、{1}",
      "start": "{0}、{1}",
      "middle": "{0}、{1}",
      "end": "{0}、{1}"
    }
  },
  "messages": {
    "app-menu.file.name": {
      "message": "檔案"
    },
    "app-menu.edit.name": {
      "message": "編輯"
    },
    "app-menu.view.name": {
      "message": "檢視"
    },
    "app-menu.help.name": {
      "message": "說明"
    },
    "app-menu.file.new-file": {
      "message": "新增檔案"
    },
    "app-menu.file.new-map-test-script": {
      "message": "新增地圖測試指令碼"
    },
    "app-menu.file.generate-definition-file": {
      "message": "產生定義檔…"
    },
    "app-menu.file.new-xs-script": {
      "message": "新增 XS 指令碼"
    },
    "app-menu.file.open-file": {
      "message": "開啟檔案…"
    },
    "app-menu.file.open-folder": {
      "message": "開啟資料夾…"
    },
    "app-menu.file.find-in-files": {
      "message": "在檔案中尋找…"
    },
    "app-menu.file.browse-installed-sources": {
      "message": "瀏覽已安裝的地圖…"
    },
    "app-menu.file.deploy-managed-mod": {
      "message": "部署為模組…"
    },
    "app-menu.file.open-linked-game-folder": {
      "message": "開啟遊戲資料夾"
    },
    "app-menu.file.unlink-game-folder": {
      "message": "取消連結遊戲資料夾"
    },
    "app-menu.file.import-map-test-report": {
      "message": "匯入測試報告…"
    },
    "app-menu.file.open-recent": {
      "message": "開啟最近使用的項目"
    },
    "app-menu.file.open-recent.empty": {
      "message": "沒有最近使用的檔案或資料夾"
    },
    "app-menu.file.save": {
      "message": "儲存"
    },
    "app-menu.file.save-as": {
      "message": "另存新檔…"
    },
    "app-menu.file.choose-default-app": {
      "message": "選擇 RMS 檔案的預設應用程式…"
    },
    "app-menu.file.choose-default-app.failed": {
      "message": "無法開啟 Windows 設定"
    },
    "app-menu.file.choose-default-app.notice.headline": {
      "message": "已開啟 Windows 設定的預設應用程式頁面"
    },
    "app-menu.file.choose-default-app.notice.cause": {
      "message": "若要使用 AoE2RMSIDE 開啟 .rms 和 .rms2 檔案，請在該頁面選取它。Windows 會在你確認後才變更預設應用程式。"
    },
    "app-menu.file.close-tab": {
      "message": "關閉分頁"
    },
    "app-menu.file.close-folder": {
      "message": "關閉資料夾"
    },
    "app-menu.file.close-window": {
      "message": "關閉視窗"
    },
    "app-menu.file.exit": {
      "message": "結束"
    },
    "app-menu.edit.undo": {
      "message": "復原"
    },
    "app-menu.edit.redo": {
      "message": "重做"
    },
    "app-menu.edit.cut": {
      "message": "剪下"
    },
    "app-menu.edit.copy": {
      "message": "複製"
    },
    "app-menu.edit.paste": {
      "message": "貼上"
    },
    "app-menu.edit.select-all": {
      "message": "全選"
    },
    "app-menu.edit.insert-snippet": {
      "message": "插入程式碼片段…"
    },
    "app-menu.edit.save-snippet": {
      "message": "儲存為程式碼片段…"
    },
    "app-menu.edit.format-document": {
      "message": "格式化文件"
    },
    "app-menu.edit.format-on-save": {
      "message": "儲存時格式化"
    },
    "app-menu.edit.indent-conditionals": {
      "message": "縮排 if/else 區塊"
    },
    "app-menu.edit.delete-permanently": {
      "message": "刪除時略過資源回收筒"
    },
    "app-menu.view.reset-layout": {
      "message": "重設版面配置"
    },
    "app-menu.view.gpu-map-rendering": {
      "message": "GPU 地圖繪製"
    },
    "app-menu.view.map-transitions": {
      "message": "地圖轉場動畫"
    },
    "app-menu.view.live-generation-stages": {
      "message": "即時顯示產生階段"
    },
    "app-menu.view.outline-row": {
      "message": "顯示大綱列"
    },
    "app-menu.view.inlay-hints": {
      "message": "顯示行內提示"
    },
    "app-menu.view.lint-rules": {
      "message": "程式碼檢查規則"
    },
    "app-menu.view.lint-rule": {
      "message": "{title}（{code}）"
    },
    "app-menu.view.external-language-servers": {
      "message": "外部語言伺服器"
    },
    "app-menu.view.external-language-server.name": {
      "message": "用於 {language} 的 {server}"
    },
    "app-menu.view.external-language-server.use": {
      "message": "使用外部語言伺服器"
    },
    "app-menu.view.external-language-server.fill-gaps": {
      "message": "以內建知識填補空缺"
    },
    "app-menu.view.language": {
      "message": "語言…"
    },
    "app-menu.view.theme-panel": {
      "message": "佈景主題…"
    },
    "app-menu.view.theme": {
      "message": "佈景主題"
    },
    "app-menu.view.theme.system": {
      "message": "跟隨系統"
    },
    "app-menu.view.theme.light": {
      "message": "淺色"
    },
    "app-menu.view.theme.dark": {
      "message": "深色"
    },
    "app-menu.view.actual-size": {
      "message": "實際大小"
    },
    "app-menu.view.zoom-in": {
      "message": "放大"
    },
    "app-menu.view.zoom-out": {
      "message": "縮小"
    },
    "app-menu.view.toggle-full-screen": {
      "message": "切換全螢幕"
    },
    "app-menu.help.take-the-tour": {
      "message": "開始導覽"
    },
    "app-menu.help.documentation": {
      "message": "說明文件"
    },
    "app-menu.help.join-discord": {
      "message": "加入 Discord"
    },
    "app-menu.help.report-bug": {
      "message": "回報錯誤"
    },
    "app-menu.help.check-for-new-versions": {
      "message": "啟動時檢查新版本"
    },
    "app-menu.help.about": {
      "message": "關於 {product}"
    },
    "tour.step": {
      "message": "{step, number}/{total, number}"
    },
    "tour.got-it": {
      "message": "我知道了"
    },
    "tour.skip": {
      "message": "略過導覽"
    },
    "tour.explorer.title": {
      "message": "檔案總管"
    },
    "tour.explorer.body.maps": {
      "message": "使用`檔案`選單中的`開啟資料夾…`或上方的資料夾按鈕，開啟存放地圖的資料夾。在資料夾上按右鍵，即可在其中建立指令碼和資料夾。"
    },
    "tour.explorer.body.scripts": {
      "message": "使用`檔案`選單中的`開啟資料夾…`或上方的資料夾按鈕，開啟存放指令碼的資料夾。在資料夾上按右鍵，即可在其中建立指令碼和資料夾。"
    },
    "tour.editor.title": {
      "message": "編輯器"
    },
    "tour.editor.body.snippets": {
      "message": "按 `Ctrl+Space` 取得建議，將指標停在字詞上即可查看說明。`Ctrl+J` 會開啟`插入程式碼片段…`，提供現成的指令碼片段。"
    },
    "tour.editor.body": {
      "message": "按 `Ctrl+Space` 取得建議，將指標停在字詞上即可查看說明。"
    },
    "tour.run.title": {
      "message": "產生地圖"
    },
    "tour.run.body": {
      "message": "按 `F5` 或執行按鈕，即可從指令碼產生地圖。在執行旁的選單中設定`種子`，在地圖上方的組態選單中設定玩家人數。"
    },
    "tour.preview.title": {
      "message": "地圖預覽"
    },
    "tour.preview.body": {
      "message": "按一下地圖格或在地圖上拖曳，即可選取地圖格。清單隨即顯示該處有哪些內容：將指標停在項目上可醒目提示，按一下則跳到對應的行。地圖角落的工具可切換檢視方式與外觀。"
    },
    "tour.preview.tip": {
      "message": "提示：預覽也能在編輯時重新產生（執行旁選單中的`編輯時執行`）。"
    },
    "tour.output.title": {
      "message": "輸出與問題"
    },
    "tour.output.body": {
      "message": "`輸出`列出每次執行及其回報內容。`問題`顯示錯誤與警告；按一下其中一項即可跳到對應的行。"
    },
    "app-menu.file.open-linked-game-folder.failed": {
      "message": "無法開啟已連結的遊戲資料夾"
    },
    "about.version": {
      "message": "版本 {version}（{commit}）"
    },
    "about.edition.xs-preview": {
      "message": "XS 指令碼編輯器"
    },
    "about.edition.rms-preview": {
      "message": "RMS 與 XS 指令碼編輯器"
    },
    "about.disclosure.independent.preview": {
      "message": "獨立開發的非官方隨機地圖指令碼編輯器。以自行實作的方式，重現 Age of Empires II: Definitive Edition 讀取隨機地圖指令碼並產生地圖的行為。"
    },
    "about.disclosure.independent": {
      "message": "獨立開發的非官方 Age of Empires II: Definitive Edition 指令碼編輯器。"
    },
    "about.disclosure.verified-versions": {
      "message": "僅針對已驗證的遊戲版本，保證產生的地圖與遊戲一致；較新的版本仍可使用，但不提供此保證。為使地圖的行為相同，部分遊戲特有的行為也會刻意重現。"
    },
    "about.disclosure.game-files.textures": {
      "message": "AoE2RMSIDE 不附帶遊戲檔案或遊戲美術素材。官方資源只從本機安裝的遊戲讀取，遊戲紋理也只從已安裝的遊戲檔案擷取。"
    },
    "about.disclosure.game-files": {
      "message": "AoE2RMSIDE 不附帶遊戲檔案或遊戲美術素材。官方資源只從本機安裝的遊戲讀取。"
    },
    "about.disclosure.affiliation": {
      "message": "本專案與 Microsoft、Xbox Game Studios、World's Edge 或 Activision 無關聯，也未獲其背書。"
    },
    "about.credits": {
      "message": "致謝\n{maintainer} — 專案創作者與維護者"
    },
    "about.credits.research": {
      "message": "感謝 {author}；我們從其撰寫的 {guide} 學到了許多隨機地圖指令碼知識。"
    },
    "about.credits.xs-research": {
      "message": "感謝 {author}；其在 {guide} 撰寫的 XS 文件，是本專案支援 XS 的起點。"
    },
    "about.close": {
      "message": "關閉"
    },
    "about.documentation": {
      "message": "說明文件"
    },
    "dialog.confirm.title": {
      "message": "確認操作"
    },
    "dialog.confirm.cancel": {
      "message": "取消"
    },
    "dialog.confirm.continue": {
      "message": "繼續"
    },
    "dialog.unsaved.title.one": {
      "message": "儲存 {name} 的變更？"
    },
    "dialog.unsaved.title.many": {
      "message": "{count, plural, other {儲存 {count} 個檔案的變更？}}"
    },
    "dialog.unsaved.description.close-window": {
      "message": "關閉視窗將遺失尚未儲存的變更。"
    },
    "dialog.unsaved.description.close-tab": {
      "message": "關閉此分頁將遺失尚未儲存的變更。"
    },
    "dialog.unsaved.description.close-folder": {
      "message": "關閉此資料夾將遺失尚未儲存的變更。"
    },
    "dialog.unsaved.description.delete": {
      "message": "刪除 {name} 將遺失尚未儲存的變更。"
    },
    "dialog.unsaved.save": {
      "message": "儲存"
    },
    "dialog.unsaved.save-all": {
      "message": "全部儲存"
    },
    "dialog.unsaved.dont-save": {
      "message": "不要儲存"
    },
    "dialog.external-change.title": {
      "message": "{name} 已在 AoE2RMSIDE 外遭到變更"
    },
    "dialog.external-change.save.description": {
      "message": "取代檔案會捨棄外部版本。請選擇從磁碟重新載入、以編輯器內容取代，或取消。"
    },
    "dialog.external-change.replace": {
      "message": "取代磁碟上的檔案"
    },
    "dialog.external-change.reload": {
      "message": "從磁碟重新載入"
    },
    "dialog.external-change.dirty.description": {
      "message": "重新載入將捨棄尚未儲存的編輯內容。也可以繼續編輯，在儲存時解決衝突。"
    },
    "dialog.external-change.keep-editing": {
      "message": "繼續編輯"
    },
    "dialog.delete-entry.title": {
      "message": "將 {name} 移至資源回收筒？"
    },
    "dialog.delete-entry.description.folder": {
      "message": "資料夾不是空的。它及其中所有項目都會移至資源回收筒。"
    },
    "dialog.delete-entry.description": {
      "message": "此項目將移至資源回收筒。"
    },
    "dialog.delete-entry.confirm": {
      "message": "移至資源回收筒"
    },
    "dialog.delete-entry.permanent.title": {